question,course,document
What steps do I need to follow to join a channel on Slack?,machine-learning-zoomcamp,4930aa19
Is it possible for me to enroll in the course even though it has already started?,machine-learning-zoomcamp,ee58a693
What are the requirements for earning a certificate in this course?,machine-learning-zoomcamp,ee58a693
"If I join the course in late November, will I still qualify for certification?",machine-learning-zoomcamp,ee58a693
How many of the course projects do I need to complete to receive a certificate?,machine-learning-zoomcamp,ee58a693
Do I have to review peers' work to be eligible for a course certificate?,machine-learning-zoomcamp,ee58a693
Are there options to take the course anytime?,machine-learning-zoomcamp,636f55d5
When is the next cohort beginning?,machine-learning-zoomcamp,636f55d5
Is there a fixed start date for the course?,machine-learning-zoomcamp,636f55d5
Can I join the course next September?,machine-learning-zoomcamp,636f55d5
Do course iterations only happen in September?,machine-learning-zoomcamp,636f55d5
Is it allowed to hand in assignments late?,machine-learning-zoomcamp,c839b764
Can homework be submitted post-deadline?,machine-learning-zoomcamp,c839b764
What happens if I miss the homework deadline?,machine-learning-zoomcamp,c839b764
Are late homework submissions acceptable?,machine-learning-zoomcamp,c839b764
Is there a way to submit homework after it's due?,machine-learning-zoomcamp,c839b764
What is the first step I should take after joining the course?,machine-learning-zoomcamp,0a278fb2
Where can I find the course materials?,machine-learning-zoomcamp,0a278fb2
How do I access videos from previous cohorts?,machine-learning-zoomcamp,0a278fb2
Where can I read everything related to my cohort's year?,machine-learning-zoomcamp,0a278fb2
When was the ML Zoomcamp first launched?,machine-learning-zoomcamp,0a278fb2
Where can I find the submission dates for assignments in this course?,machine-learning-zoomcamp,8de4fefd
How can I access the 2023 cohort timetable?,machine-learning-zoomcamp,8de4fefd
Are the due dates available for the current cohort?,machine-learning-zoomcamp,8de4fefd
Which page contains the 2023 course deadlines?,machine-learning-zoomcamp,8de4fefd
Is there a specific page I should refer to for this year's important dates?,machine-learning-zoomcamp,8de4fefd
What is the main difference between the 2022 and 2023 iterations of the course?,machine-learning-zoomcamp,94e86808
Is there a special module in the 2023 course that was not included in 2022?,machine-learning-zoomcamp,94e86808
Are the course modules for 2023 different from those in 2022?,machine-learning-zoomcamp,94e86808
What changes have been made to the homework assignments in the 2023 course?,machine-learning-zoomcamp,94e86808
Was a special module like BentoML included in the 2023 iteration?,machine-learning-zoomcamp,94e86808
Are the course videos being updated or are we using the 2021 ones?,machine-learning-zoomcamp,e7ba6b8a
Is it necessary to have participated in the previous iteration to benefit from the course videos?,machine-learning-zoomcamp,e7ba6b8a
Are the skills taught in the videos still relevant for the current iteration?,machine-learning-zoomcamp,e7ba6b8a
"Should we continue using Python 3.8 for this course, or is there a new recommendation?",machine-learning-zoomcamp,e7ba6b8a
Why aren't the course videos being re-recorded for this iteration?,machine-learning-zoomcamp,e7ba6b8a
How should I use the #mlzoomcamp tag when sharing my course learnings on social media?,machine-learning-zoomcamp,f7bc2f65
What is the process for submitting learning in public links when turning in homework?,machine-learning-zoomcamp,f7bc2f65
Is there a limit to the number of extra score points I can earn for posting learning links?,machine-learning-zoomcamp,f7bc2f65
Can I earn the maximum points by posting the same content on multiple social platforms?,machine-learning-zoomcamp,f7bc2f65
How are points for learning links doubled for midterms or capstone projects?,machine-learning-zoomcamp,f7bc2f65
How can I add my community notes for the course?,machine-learning-zoomcamp,ae52a907
Where should I link my notes in the course repository?,machine-learning-zoomcamp,ae52a907
What is the process to sync my fork with the original course repo?,machine-learning-zoomcamp,ae52a907
Do I need to create a GitHub repository for my course notes?,machine-learning-zoomcamp,ae52a907
Who provided the instructions for adding community notes?,machine-learning-zoomcamp,ae52a907
How can I compute a hash for my email for the leaderboard using Python?,machine-learning-zoomcamp,dab5a24a
Where can I find the leaderboard for 2023?,machine-learning-zoomcamp,dab5a24a
What is the purpose of the quotes when calling the compute_hash function?,machine-learning-zoomcamp,dab5a24a
Is there an online tool I can use to hash my email for this course?,machine-learning-zoomcamp,dab5a24a
Who provided the instruction for the Python hashing code in the document?,machine-learning-zoomcamp,dab5a24a
What should I do if wget is not recognized as a command in Windows?,machine-learning-zoomcamp,49f9bda9
How can I download a file from a URL using Python in Jupyter Notebook?,machine-learning-zoomcamp,49f9bda9
What are some methods to bypass HTTPS checks when reading a CSV from a URL in Python?,machine-learning-zoomcamp,49f9bda9
How can I use wget functionality in Python if it's not installed on my system?,machine-learning-zoomcamp,49f9bda9
Is there a standard Python library for downloading files from the internet on all platforms?,machine-learning-zoomcamp,49f9bda9
How can I download a CSV file within a Jupyter Notebook for the machine learning course?,machine-learning-zoomcamp,d44de7d1
What is the purpose of the exclamation mark when using shell commands in a notebook?,machine-learning-zoomcamp,d44de7d1
"Can I use shell commands like mkdir and mv in Jupyter Notebooks, and how would I execute them?",machine-learning-zoomcamp,d44de7d1
Is it possible to organize my downloaded data into a specific directory using shell commands in a notebook?,machine-learning-zoomcamp,d44de7d1
How would I move a downloaded housing.csv file into a new directory while working in a notebook?,machine-learning-zoomcamp,d44de7d1
How can I use WSL on a Windows 11 device to access Linux?,machine-learning-zoomcamp,314ebe32
What link should I use to set up a WSL development environment on Windows 11?,machine-learning-zoomcamp,314ebe32
How do I connect VS Code to my WSL Ubuntu instance?,machine-learning-zoomcamp,314ebe32
Which VS Code extension is required to connect to WSL on Windows?,machine-learning-zoomcamp,314ebe32
Who provided the answer for setting up WSL and VS Code integration?,machine-learning-zoomcamp,314ebe32
How can a beginner upload homework to GitHub without encountering errors?,machine-learning-zoomcamp,98cff602
What steps should I follow to resolve the 'src refspec master does not match any' error when pushing to GitHub?,machine-learning-zoomcamp,98cff602
Are there any tutorials for beginners on using GitHub effectively for uploading code?,machine-learning-zoomcamp,98cff602
Can I upload my code to GitHub directly from Google Colab?,machine-learning-zoomcamp,98cff602
What alternative methods can I use to upload files to GitHub if I'm new to coding?,machine-learning-zoomcamp,98cff602
What causes a singular matrix error when inverting matrices in the homework?,machine-learning-zoomcamp,54ec0de4
Why does matrix multiplication order matter in the context of avoiding singular matrix errors?,machine-learning-zoomcamp,54ec0de4
How does a non-commutative property of dot products lead to a singular matrix error?,machine-learning-zoomcamp,54ec0de4
What should I pay attention to when using the .dot method to avoid matrix inversion errors?,machine-learning-zoomcamp,54ec0de4
Why is it incorrect to assume X.dot(Y) equals Y.dot(X) in homework calculations?,machine-learning-zoomcamp,54ec0de4
Why doesn't the conda create command work on my terminal?,machine-learning-zoomcamp,f81f4ecb
What should I do if Conda is not recognized as an internal command?,machine-learning-zoomcamp,f81f4ecb
"On Windows, which terminal can I use with Anaconda?",machine-learning-zoomcamp,f81f4ecb
What should I install if I don't have Anaconda or Miniconda for running conda commands?,machine-learning-zoomcamp,f81f4ecb
Is Python version 3.9 the only compatible version for this course?,machine-learning-zoomcamp,f81f4ecb
Why does using a backslash in the file path cause issues when reading a CSV with Pandas on Windows?,machine-learning-zoomcamp,be760b92
How can I correctly read a CSV file in Windows with Pandas without encountering escape sequence errors?,machine-learning-zoomcamp,be760b92
What is the role of the 'r' prefix in the file path when using Pandas on Windows?,machine-learning-zoomcamp,be760b92
Why might my code not work when trying to read a file path with backslashes in Python?,machine-learning-zoomcamp,be760b92
How should I modify the file path in Pandas to prevent issues due to backslashes on Windows?,machine-learning-zoomcamp,be760b92
What should I do if I encounter a '403 Forbidden' error when pushing to a GitHub repository?,machine-learning-zoomcamp,a2cfa1c9
How can I verify the current URL configuration for my GitHub repository?,machine-learning-zoomcamp,a2cfa1c9
What command should I use to change the remote URL for my GitHub repository?,machine-learning-zoomcamp,a2cfa1c9
Who added the solution for the '403 Forbidden' error message in the FAQ?,machine-learning-zoomcamp,a2cfa1c9
What format should the GitHub repository URL be changed to avoid the '403 Forbidden' error?,machine-learning-zoomcamp,a2cfa1c9
What should I do if I encounter 'Fatal: Authentication failed for' when pushing to GitHub?,machine-learning-zoomcamp,7b907071
Why did password authentication fail when trying to push code to GitHub?,machine-learning-zoomcamp,7b907071
How can I resolve an authentication failure error when using Git Bash with GitHub?,machine-learning-zoomcamp,7b907071
What steps should I follow to use a personal access token for GitHub authentication?,machine-learning-zoomcamp,7b907071
Where can I find information on connecting to GitHub using SSH after August 2021?,machine-learning-zoomcamp,7b907071
How can I resolve the 'wget: unable to resolve host address' error in Kaggle?,machine-learning-zoomcamp,fc2e0a61
What should I do to import a dataset from GitHub in Kaggle without errors?,machine-learning-zoomcamp,fc2e0a61
Why can't I resolve the host address 'raw.githubusercontent.com' in Kaggle?,machine-learning-zoomcamp,fc2e0a61
What steps should I follow if I encounter a name resolution failure while using wget in Kaggle?,machine-learning-zoomcamp,fc2e0a61
How can I enable Internet in Kaggle to avoid resolution failures with wget?,machine-learning-zoomcamp,fc2e0a61
How can I create a virtual environment for Python using VS Code?,machine-learning-zoomcamp,d43e5742
Is it possible to use Jupyter Notebooks natively in VS Code without a web browser?,machine-learning-zoomcamp,d43e5742
How does port forwarding enable remote execution of Jupyter Notebooks in VS Code?,machine-learning-zoomcamp,d43e5742
What steps are necessary for configuring a remote connection in VS Code for Jupyter Notebooks?,machine-learning-zoomcamp,d43e5742
How can I use GitHub for staging and commits through the VS Code interface?,machine-learning-zoomcamp,d43e5742
Do we have to run 'conda create -n ...' each time we open VS Code for the project?,machine-learning-zoomcamp,32bc0538
Is it necessary to use 'conda activate ml-zoomcamp' every time we work on the project?,machine-learning-zoomcamp,32bc0538
How do we create an environment file for reproducing our Conda environment?,machine-learning-zoomcamp,32bc0538
Can we recreate our environment using a YAML file?,machine-learning-zoomcamp,32bc0538
What is the purpose of 'conda create -n ...' command in Conda setup?,machine-learning-zoomcamp,32bc0538
Why doesn't the inverse multiplied by the original matrix return an exact identity matrix in the Week 1 Homework Question 7?,machine-learning-zoomcamp,b6730228
What causes small errors like -1.38777878e-16 when multiplying a matrix by its inverse?,machine-learning-zoomcamp,b6730228
How does floating point precision affect outcomes like inverting matrices in machine learning calculations?,machine-learning-zoomcamp,b6730228
"Why are there discrepancies when performing matrix operations on a computer, such as inverting XTX in the homework?",machine-learning-zoomcamp,b6730228
What should I understand about floating point errors when working on matrix operations in machine learning tasks?,machine-learning-zoomcamp,b6730228
What is the function of pandas.DataFrame.info()?,machine-learning-zoomcamp,3ce9bbb8
How can I find the datatype of an index in a dataset?,machine-learning-zoomcamp,3ce9bbb8
Which method displays column information such as not-null count and datatype?,machine-learning-zoomcamp,3ce9bbb8
How can I check the memory usage of a dataset in pandas?,machine-learning-zoomcamp,3ce9bbb8
What command is used to get a summary of dataset entries and their types?,machine-learning-zoomcamp,3ce9bbb8
What should I do if I encounter 'NameError: name np is not defined' during my work?,machine-learning-zoomcamp,4e584d06
How can I resolve the 'NameError: name pd is not defined' error in my script?,machine-learning-zoomcamp,4e584d06
What might be causing the 'name np is not defined' error when using NumPy in my code?,machine-learning-zoomcamp,4e584d06
Which libraries should I import to avoid 'NameError' issues in my data analysis project?,machine-learning-zoomcamp,4e584d06
What are the initial import statements I should include when using pandas and numpy in my project?,machine-learning-zoomcamp,4e584d06
question1,machine-learning-zoomcamp,ff4da2b6
question2,machine-learning-zoomcamp,ff4da2b6
question3,machine-learning-zoomcamp,ff4da2b6
question4,machine-learning-zoomcamp,ff4da2b6
question5,machine-learning-zoomcamp,ff4da2b6
What attribute in Pandas can be used to find the number of rows and columns in a dataset?,machine-learning-zoomcamp,58c1c168
How can you identify the total number of columns in a dataset using Pandas?,machine-learning-zoomcamp,58c1c168
What is one method to determine a dataset's shape in Pandas according to Radikal Lukafiardi?,machine-learning-zoomcamp,58c1c168
"If you need to know how many rows are in a dataset using Pandas, which attribute would you use?",machine-learning-zoomcamp,58c1c168
Can you explain how to retrieve the number of columns from a dataset in Pandas?,machine-learning-zoomcamp,58c1c168
How can I prevent value errors related to array shapes in my machine learning homework?,machine-learning-zoomcamp,96076a1a
What should I use for matrix multiplication to avoid errors in machine learning exercises?,machine-learning-zoomcamp,96076a1a
Why is the order important in matrix multiplication for machine learning tasks?,machine-learning-zoomcamp,96076a1a
What dimension condition must be met for successful matrix multiplication in projects?,machine-learning-zoomcamp,96076a1a
Who provided the solution for handling matrix dimension mismatches in the FAQ?,machine-learning-zoomcamp,96076a1a
What is the process for substituting NaN values with the mean of the column?,machine-learning-zoomcamp,3218389a
Why do we choose to impute NaN values rather than removing the rows?,machine-learning-zoomcamp,3218389a
What is the term used for replacing NaN values with a column's mean?,machine-learning-zoomcamp,3218389a
How can imputing help when a row has missing values but is still valuable?,machine-learning-zoomcamp,3218389a
What is the advantage of saving the mean to a variable before replacing NaN values?,machine-learning-zoomcamp,3218389a
What mathematical formula is necessary for solving a linear regression problem in our course?,machine-learning-zoomcamp,183a1c90
Can you explain what happens when a Matrix X is multiplied by unknown weights w in linear regression?,machine-learning-zoomcamp,183a1c90
Where can I find additional resources like reading or videos on multiple linear regression in matrix form?,machine-learning-zoomcamp,183a1c90
Who contributed additional comments to the explanation provided by Sylvia Schmitt?,machine-learning-zoomcamp,183a1c90
What is the role of the pseudoinverse solution in ordinary least squares?,machine-learning-zoomcamp,183a1c90
Why might the final multiplication result not have 5 columns?,machine-learning-zoomcamp,f0bc1c19
What could cause issues in the final multiplication step?,machine-learning-zoomcamp,f0bc1c19
Which step might have been interchanged causing a multiplication error?,machine-learning-zoomcamp,f0bc1c19
Who added the answer about the final multiplication issue?,machine-learning-zoomcamp,f0bc1c19
What is likely the critical mistake in the initial multiplication steps?,machine-learning-zoomcamp,f0bc1c19
What operator is used for matrix multiplication in some sources?,machine-learning-zoomcamp,735e6c78
Which operator should be used for element-wise multiplication or Hadamard product?,machine-learning-zoomcamp,735e6c78
"When performing matrix-matrix multiplication, what operator or function is recommended by numpy documentation?",machine-learning-zoomcamp,735e6c78
What is the preferred method for multiplying a matrix by a scalar?,machine-learning-zoomcamp,735e6c78
"Which functions in numpy can be used for matrix or vector multiplication, aside from the @ operator?",machine-learning-zoomcamp,735e6c78
What should I do if I encounter an ImportError related to 'contextfilter' from 'jinja2' when launching a Jupyter notebook?,machine-learning-zoomcamp,b8ca1cd3
How can I resolve the error involving 'contextfilter' when using a new Jupyter notebook environment?,machine-learning-zoomcamp,b8ca1cd3
What steps are needed to fix the ImportError from jinja2 when starting a new notebook?,machine-learning-zoomcamp,b8ca1cd3
How can I address the ImportError from 'jinja2' in a fresh Jupyter notebook setup?,machine-learning-zoomcamp,b8ca1cd3
What is the solution for the ImportError linked to 'jinja2' when creating a new notebook environment?,machine-learning-zoomcamp,b8ca1cd3
What should I do if downloading housing.csv using wget on MacOS Ventura M1 hangs?,machine-learning-zoomcamp,efdb235f
How do I resolve wget hanging with IPv6 addresses on Mac?,machine-learning-zoomcamp,efdb235f
Where can I adjust the IPv6 settings to fix wget issues?,machine-learning-zoomcamp,efdb235f
Which settings need change if wget stalls with an IPv6 address on MacOS?,machine-learning-zoomcamp,efdb235f
How to configure the network if wget hangs with IPv6 on MacOS Ventura M1?,machine-learning-zoomcamp,efdb235f
What alternative can I use on macOS if WGET is not available?,machine-learning-zoomcamp,355348f0
How do I save a file using a utility to retrieve information from a URL on macOS?,machine-learning-zoomcamp,355348f0
What is the purpose of the '-o' option in the curl command?,machine-learning-zoomcamp,355348f0
Where should I place the URL in the curl command to retrieve data?,machine-learning-zoomcamp,355348f0
Where can I find more information about using curl for downloading files?,machine-learning-zoomcamp,355348f0
What methods can be used to format a number to a specific number of decimal places in Python?,machine-learning-zoomcamp,67afabf5
Can you give an example of using the round function to format a number to four decimal places?,machine-learning-zoomcamp,67afabf5
How can f-strings be used to format a number to three decimal places?,machine-learning-zoomcamp,67afabf5
"Is there a way to round values in an entire pandas series, and where can I find more information?",machine-learning-zoomcamp,67afabf5
Who added the information about rounding numbers in the course material?,machine-learning-zoomcamp,67afabf5
How can I find the crucial links to get started with Week 2 for the Machine Learning course?,machine-learning-zoomcamp,50d737e7
Where can I ask questions for the live sessions during Week 2?,machine-learning-zoomcamp,50d737e7
"How can I access the calendar for the weekly meetings starting September 18, 2023?",machine-learning-zoomcamp,50d737e7
Where is the homework for Week 2 of the regression course hosted?,machine-learning-zoomcamp,50d737e7
How should I submit the homework for Week 2?,machine-learning-zoomcamp,50d737e7
How can we check if the data has a long tail for the median house value?,machine-learning-zoomcamp,bbc0fca3
Which libraries are utilized for plotting the histogram in the method provided?,machine-learning-zoomcamp,bbc0fca3
What does the skewness of the median house value tell us about the data?,machine-learning-zoomcamp,bbc0fca3
Where can the data for examining the long tail be found?,machine-learning-zoomcamp,bbc0fca3
What is the first step in exploring the distribution of median house value using seaborn?,machine-learning-zoomcamp,bbc0fca3
Why might I encounter a LinAlgError: Singular matrix in this course?,machine-learning-zoomcamp,6f3bdd20
Where can I find the explanation for the Singular Matrix error that happens when I follow course videos?,machine-learning-zoomcamp,6f3bdd20
Is it normal to encounter a Singular Matrix error during the course exercises?,machine-learning-zoomcamp,6f3bdd20
Could performing the inverse of X multiple times in my code cause an error?,machine-learning-zoomcamp,6f3bdd20
Who provided the information regarding the Singular Matrix error in this course?,machine-learning-zoomcamp,6f3bdd20
Where can I find a detailed description of the California housing dataset?,machine-learning-zoomcamp,27c2d90a
What resource provides information about the California housing dataset used in this section?,machine-learning-zoomcamp,27c2d90a
Is there a link to learn more about the California housing dataset used in this course?,machine-learning-zoomcamp,27c2d90a
Can you guide me to a detailed description of the dataset used in the regression section?,machine-learning-zoomcamp,27c2d90a
How can I access further details about the California housing dataset mentioned in this section?,machine-learning-zoomcamp,27c2d90a
Why am I getting NaN results when using .mean() after calculating rmse?,machine-learning-zoomcamp,88e9600a
What could cause NaN values to appear when using for loops to compute rmse?,machine-learning-zoomcamp,88e9600a
How can I prevent NaN values in my dataset when calculating rmse?,machine-learning-zoomcamp,88e9600a
Why is my rmse calculation returning NaNs after splitting the data?,machine-learning-zoomcamp,88e9600a
What steps can be taken to fix NaN issues in RMSE calculations in machine learning data?,machine-learning-zoomcamp,88e9600a
Why is transforming the target variable to a logarithm distribution important in machine learning for regression?,machine-learning-zoomcamp,d59d8df7
Is it necessary to transform the target variable for every machine learning project?,machine-learning-zoomcamp,d59d8df7
When should we consider using a logarithm transformation for the target variable?,machine-learning-zoomcamp,d59d8df7
How can we determine if the target variable is highly skewed?,machine-learning-zoomcamp,d59d8df7
Where can I find more information about skewness in data distributions?,machine-learning-zoomcamp,d59d8df7
How can I import a dataset into a pandas dataframe from a GitHub link in the context of machine learning for regression?,machine-learning-zoomcamp,0b3eaf92
What is the method to read a dataset directly from a GitHub URL into a pandas dataframe for regression purposes?,machine-learning-zoomcamp,0b3eaf92
"In machine learning for regression, how do I read a dataset from a GitHub link using pandas?",machine-learning-zoomcamp,0b3eaf92
Could you explain how to fetch a dataset from a GitHub repository into a pandas dataframe for a regression task?,machine-learning-zoomcamp,0b3eaf92
What technique is used to load a dataset into a pandas dataframe from a GitHub link for regression analysis?,machine-learning-zoomcamp,0b3eaf92
How can I download the dataset directly in Kaggle Notebooks for our regression course?,machine-learning-zoomcamp,8fe56032
What is the necessary command to use when loading datasets in Kaggle Notebooks?,machine-learning-zoomcamp,8fe56032
Which file format is used when reading the loaded dataset into pandas?,machine-learning-zoomcamp,8fe56032
Why is it important to include an exclamation mark before the wget command in Kaggle Notebooks?,machine-learning-zoomcamp,8fe56032
Can you guide me on how to read the dataset into a pandas DataFrame after downloading it on Kaggle Notebooks?,machine-learning-zoomcamp,8fe56032
How can I filter a dataset based on specific values in the 'ocean_proximity' column?,machine-learning-zoomcamp,af833e0a
Which operator should I use for 'OR' while filtering a dataset in Python?,machine-learning-zoomcamp,af833e0a
What operator is used for 'AND' when filtering a dataset by its values?,machine-learning-zoomcamp,af833e0a
Is there an alternative method to filter a dataset by checking if 'ocean_proximity' matches certain values?,machine-learning-zoomcamp,af833e0a
What method allows filtering on multiple categorical values within a column in a dataset?,machine-learning-zoomcamp,af833e0a
What is another method to load the dataset if not directly from GitHub?,machine-learning-zoomcamp,8d209d6d
How can I use the requests library to load data for homework?,machine-learning-zoomcamp,8d209d6d
What should I do if the response from the requests library is successful?,machine-learning-zoomcamp,8d209d6d
What does the code do if the response status code is 200?,machine-learning-zoomcamp,8d209d6d
How should I handle a failed download when using the requests library?,machine-learning-zoomcamp,8d209d6d
Why is a null column appearing in my dataframe even after using the fillna method?,machine-learning-zoomcamp,0bc4c3da
How can I ensure that no references are attaching my train and val variables to the original dataframe?,machine-learning-zoomcamp,0bc4c3da
