question,course,document
How can I fix the error related to the Parquet column 'DOlocationID' having a type mismatch?,data-engineering-zoomcamp,c65d8fd9
What should I do if the dim_zones.sql dataset is not found in location US when running fact_trips.sql?,data-engineering-zoomcamp,c65d8fd9
How can I resolve the cpp_type DOUBLE error in the Parquet file for 'DOlocationID'?,data-engineering-zoomcamp,c65d8fd9
What changes are needed to address an error when the dataset dim_zones.sql is not located in the US?,data-engineering-zoomcamp,c65d8fd9
How can I update the configuration to handle a location error while running dim_zones and fact_trips?,data-engineering-zoomcamp,c65d8fd9
What should I do if I encounter an error indicating that Parquet column 'DOlocationID' has type INT64 which does not match the target cpp_type DOUBLE?,data-engineering-zoomcamp,c1a95536
How can I resolve the issue when trying to export an ML model to make predictions on a MacBook with an Apple M1 chip?,data-engineering-zoomcamp,c1a95536
What is the alternative to the standard TensorFlow serving docker pull command for MacBook M1 users?,data-engineering-zoomcamp,c1a95536
Which docker pull command should be used instead of 'docker pull tensorflow/serving' for Apple M1 chips?,data-engineering-zoomcamp,c1a95536
What steps should be followed to set up serving_dir for model prediction on a MacBook with an arm architecture?,data-engineering-zoomcamp,c1a95536
What steps should I take if I encounter a Parquet column type mismatch error involving DOlocationID?,data-engineering-zoomcamp,bba0da04
How can I address an issue when my virtual machine reaches its storage capacity?,data-engineering-zoomcamp,bba0da04
What are effective methods to locate and remove large files on my virtual machine?,data-engineering-zoomcamp,bba0da04
How should I modify my flow code if I need to delete Prefect-related files?,data-engineering-zoomcamp,bba0da04
What processes need to be terminated after deleting files to address a storage issue on my VM?,data-engineering-zoomcamp,bba0da04
What is the reason for the error 'Parquet column DOlocationID has type INT64 which does not match the target cpp_type DOUBLE'?,data-engineering-zoomcamp,a2120335
Why does 'Stop with loading the files into a bucket' mean not to perform data cleaning and put it in parquet format?,data-engineering-zoomcamp,a2120335
How should I proceed if I'm loading files into a bucket for homework?,data-engineering-zoomcamp,a2120335
Can you clarify what I need to do after loading files into the bucket for the homework assignment?,data-engineering-zoomcamp,a2120335
What steps should be taken when creating an external table after loading files into a bucket?,data-engineering-zoomcamp,a2120335
What causes the out-of-bounds error when reading NYC parquet files into pandas?,data-engineering-zoomcamp,a4ba2478
How does pandas' timestamp format contribute to errors when reading certain parquet files?,data-engineering-zoomcamp,a4ba2478
What is the workaround for reading parquet files with out-of-bounds timestamp data?,data-engineering-zoomcamp,a4ba2478
How can I handle the problematic timestamps when using pyarrow to read parquet files?,data-engineering-zoomcamp,a4ba2478
What method can be used to filter out rows with out-of-bounds datetime values in parquet files?,data-engineering-zoomcamp,a4ba2478
What is causing the error with the Parquet column 'DOlocationID'?,data-engineering-zoomcamp,74c361fe
How can I access the monthly 2022 NYC taxi data files for green taxis?,data-engineering-zoomcamp,74c361fe
What data type mismatch is causing an error in my table?,data-engineering-zoomcamp,74c361fe
Do I need to download each month's 2022 taxi data file separately for homework 3?,data-engineering-zoomcamp,74c361fe
How can I refer to all 12 monthly taxi data files using a single string in BigQuery?,data-engineering-zoomcamp,74c361fe
What should I do to avoid schema issues when uploading homework files to GCS?,data-engineering-zoomcamp,b9b3ef9f
How can I upload multiple files to GCS at once?,data-engineering-zoomcamp,b9b3ef9f
Is there an option to upload a whole folder to GCS?,data-engineering-zoomcamp,b9b3ef9f
What is a common error when reading the table trips_data_all.external_fhv_tripdata?,data-engineering-zoomcamp,b9b3ef9f
What is the correct process for uploading files to GCS via the GUI to prevent errors?,data-engineering-zoomcamp,b9b3ef9f
question1,data-engineering-zoomcamp,009ac612
question2,data-engineering-zoomcamp,009ac612
question3,data-engineering-zoomcamp,009ac612
question4,data-engineering-zoomcamp,009ac612
question5,data-engineering-zoomcamp,009ac612
What should I do if I'm encountering an error related to Parquet column 'DOlocationID' type mismatch?,data-engineering-zoomcamp,68815ec2
"In Module 3 homework question 6, is it common to not get an exact match for the provided options?",data-engineering-zoomcamp,68815ec2
What advice did Alexey give regarding choosing an option in Module 3 homework question 6 when an exact match isn't found?,data-engineering-zoomcamp,68815ec2
How are students handling the situation where the INT64 data type doesn't match the expected DOUBLE type in the table?,data-engineering-zoomcamp,68815ec2
Is it acceptable to pick an option that is very close but not exactly matching in Module 3 homework question 6?,data-engineering-zoomcamp,68815ec2
What should I do to fix the datatype mismatch error in Parquet column 'DOlocationID'?,data-engineering-zoomcamp,c8ad08b3
How can I resolve a Python 'invalid start byte' error when decoding?,data-engineering-zoomcamp,c8ad08b3
What is the recommended encoding for reading data into a pandas dataframe from a web source?,data-engineering-zoomcamp,c8ad08b3
How can I write a pandas dataframe to GCS as a CSV with gzip compression?,data-engineering-zoomcamp,c8ad08b3
What alternative method can be used to avoid encoding issues when reading data into pandas?,data-engineering-zoomcamp,c8ad08b3
What keyword does a Python generator use to return an iterator?,data-engineering-zoomcamp,d68b433f
How do Python generators differ from lists or tuples in terms of memory usage?,data-engineering-zoomcamp,d68b433f
What Python function type yields values one at a time during iteration?,data-engineering-zoomcamp,d68b433f
Why are Python generators considered efficient for handling large datasets?,data-engineering-zoomcamp,d68b433f
"In Python, which type of iterable generates values dynamically as they are accessed?",data-engineering-zoomcamp,d68b433f
What type mismatch error occurs when reading the table trips_data_all.external_fhv_tripdata?,data-engineering-zoomcamp,e265ee5a
What is the easiest method to read multiple files simultaneously using Python?,data-engineering-zoomcamp,e265ee5a
What is the error message for the type INT64 not matching cpp_type DOUBLE in Parquet?,data-engineering-zoomcamp,e265ee5a
Which function allows reading a list of files into one table?,data-engineering-zoomcamp,e265ee5a
How can Parquet files be merged into a single result?,data-engineering-zoomcamp,e265ee5a
What is the correct way to convert the 'DOlocationID' column when encountering a mismatch error with INT64 and DOUBLE?,data-engineering-zoomcamp,0e7dfddc
How should I correctly change the data type of 'DOlocationID' to resolve the parquet file type error?,data-engineering-zoomcamp,0e7dfddc
What conversion strategy should be avoided when handling the 'DOlocationID' column data type error?,data-engineering-zoomcamp,0e7dfddc
Why does using df['DOlocationID'].astype(int) not solve the 'DOlocationID' column error?,data-engineering-zoomcamp,0e7dfddc
Can you explain how to properly handle the data type mismatch error for the 'DOlocationID' column?,data-engineering-zoomcamp,0e7dfddc
What could cause a ValueError related to Prefect storage path during flow execution?,data-engineering-zoomcamp,0a059700
How can I resolve an error involving a missing Prefect storage path while running a flow?,data-engineering-zoomcamp,0a059700
What steps should I take if my Prefect flow is not running due to a 'DOlocationID' type mismatch?,data-engineering-zoomcamp,0a059700
Why might using 'cache_key_fn=task_input_hash' cause an error on subsequent runs in Prefect?,data-engineering-zoomcamp,0a059700
"What is the benefit of using a cache key in Prefect, and how might it lead to errors?",data-engineering-zoomcamp,0a059700
How can I download a csv.gz file from a URL using Prefect in the analytics engineering with dbt?,data-engineering-zoomcamp,feca7402
What is the task definition for downloading a file in a Prefect environment as shown in Module 4?,data-engineering-zoomcamp,feca7402
Can you provide a sample snippet for downloading a file from the web using Prefect?,data-engineering-zoomcamp,feca7402
What is the purpose of the 'extract_from_web' flow in the dbt module?,data-engineering-zoomcamp,feca7402
Which function in Prefect handles the downloading of csv.gz files based on the provided sample?,data-engineering-zoomcamp,feca7402
What should I do if I encounter a 'not found in location us' error in dbt?,data-engineering-zoomcamp,1f519b1a
How do I resolve a 'DBT Cloud production error' when the dataset is not available in location EU?,data-engineering-zoomcamp,1f519b1a
What is the solution to the prod dataset being created in BigQuery with location US instead of EU?,data-engineering-zoomcamp,1f519b1a
Why might everything work in development mode but fail in production mode when using dbt Cloud?,data-engineering-zoomcamp,1f519b1a
What steps were taken to resolve the issue of the prod dataset location in dbt Cloud?,data-engineering-zoomcamp,1f519b1a
What should I do if there's no development environment configured in dbt?,data-engineering-zoomcamp,43c454c7
How can I solve the error related to development environment setup in dbt?,data-engineering-zoomcamp,43c454c7
Where can I find guidance on creating a development environment for dbt?,data-engineering-zoomcamp,43c454c7
Which resources are available for setting up a development environment in dbt?,data-engineering-zoomcamp,43c454c7
How does the error message help in resolving the development environment issue in dbt?,data-engineering-zoomcamp,43c454c7
What should I do if I encounter a runtime error when my dbt Cloud can't connect to BigQuery?,data-engineering-zoomcamp,d7ad69da
How do I resolve an 'Access Denied' error for my BigQuery project when connecting through dbt Cloud?,data-engineering-zoomcamp,d7ad69da
Which permissions do I need to grant to my service account to fix the BigQuery connection error?,data-engineering-zoomcamp,d7ad69da
Where can I find detailed steps to resolve dbt connection issues with BigQuery?,data-engineering-zoomcamp,d7ad69da
What additional roles should I assign to prevent future BigQuery permissions issues in this course?,data-engineering-zoomcamp,d7ad69da
What should I do if my dbt Cloud run is cancelled due to a missing project?,data-engineering-zoomcamp,03fdb780
How can I fix a dbt build error when a valid dbt project is not found?,data-engineering-zoomcamp,03fdb780
What might be wrong if my dbt Cloud run requires a dbt_project.yml file?,data-engineering-zoomcamp,03fdb780
How do I specify the location of my dbt project in dbt Cloud settings?,data-engineering-zoomcamp,03fdb780
Why would I encounter an error if my dbt project is in a repository subdirectory?,data-engineering-zoomcamp,03fdb780
What should I do if I receive a permission denied error while trying to clone the repository in Module 4?,data-engineering-zoomcamp,9c85f3aa
How can I resolve the error 'Failed to clone repository' in analytics engineering with dbt?,data-engineering-zoomcamp,9c85f3aa
What are the steps to take if I cannot read from a remote repository due to permission issues?,data-engineering-zoomcamp,9c85f3aa
What is the solution when I encounter a fatal error related to GitHub public key while cloning?,data-engineering-zoomcamp,9c85f3aa
What alternative methods can I try if I face issues with a publickey when cloning the repo in Module 4?,data-engineering-zoomcamp,9c85f3aa
Why is the 'Triggered by pull requests' option disabled when I create a new CI job in dbt Cloud?,data-engineering-zoomcamp,63026349
What plan do I need to be on to set up a CI Job in dbt Cloud?,data-engineering-zoomcamp,63026349
"If I'm on the Developer Plan and 'Triggered by pull requests' is disabled, what should I do?",data-engineering-zoomcamp,63026349
What can I do if I'm in the Team Plan and the 'Trigger by pull requests' option is still disabled?,data-engineering-zoomcamp,63026349
Does the workaround for the 'This works for the Developer plan' apply to any plan?,data-engineering-zoomcamp,63026349
What do I do if my IDE session for DBT cloud will not start?,data-engineering-zoomcamp,6ba02f77
How can I resolve the IDE loading issue in DBT cloud?,data-engineering-zoomcamp,6ba02f77
What steps should I take if my DBT cloud setup shows an error?,data-engineering-zoomcamp,6ba02f77
Where can I find instructions to fix the DBT cloud IDE session problem?,data-engineering-zoomcamp,6ba02f77
How do I fix the infinite loading error for the DBT cloud IDE?,data-engineering-zoomcamp,6ba02f77
What should I do if I'm encountering datatype issues when converting CSV to Parquet for dbt/BigQuery?,data-engineering-zoomcamp,8b14286c
How can I modify the script to handle gz files in the web_to_gcp.py pipeline?,data-engineering-zoomcamp,8b14286c
"What does the error about Parquet column type mismatch mean, and how can I resolve it?",data-engineering-zoomcamp,8b14286c
What options do I have to fix schema mismatches in Parquet files when used with BigQuery?,data-engineering-zoomcamp,8b14286c
How can I handle null values in integer columns when using pandas for CSV data processing?,data-engineering-zoomcamp,8b14286c
What should I do if I receive an Access Denied error when using the quick script to load trip data into GCS?,data-engineering-zoomcamp,14a876ea
How can I download the trip data if the provided S3 URL isn't working?,data-engineering-zoomcamp,14a876ea
What are the GitHub CLI commands needed to download NYC TLC data?,data-engineering-zoomcamp,14a876ea
Where can I find instructions to download the GitHub CLI?,data-engineering-zoomcamp,14a876ea
How can I upload the downloaded files to a GCS bucket?,data-engineering-zoomcamp,14a876ea
What error occurs when converting fhv_tripdata_2020-01.csv to Parquet using Airflow?,data-engineering-zoomcamp,1cf5be74
Why is the conversion of fhv_tripdata_2020-01.csv necessary for the homework?,data-engineering-zoomcamp,1cf5be74
What causes the ArrowInvalid error during the CSV to Parquet conversion?,data-engineering-zoomcamp,1cf5be74
How can the ArrowInvalid error be fixed when processing the fhv_tripdata_2020-01.csv?,data-engineering-zoomcamp,1cf5be74
What should be done in Airflow after fixing the line breaks issue in the fhv_tripdata_2020-01.csv?,data-engineering-zoomcamp,1cf5be74
What is the initial method used to load yellow and green trip data for 2019 and 2020 in Module 4 analytics engineering?,data-engineering-zoomcamp,315ac3cc
Why was the initial method for loading yellow trip data found to be inefficient?,data-engineering-zoomcamp,315ac3cc
What issue arose when directly uploading parquet files to Google Cloud Storage for yellow trip data?,data-engineering-zoomcamp,315ac3cc
Who suggested an alternative hack on the Slack channel for loading data in Module 4?,data-engineering-zoomcamp,315ac3cc
What additional step is recommended when following the optional hack for loading data to BigQuery during Week 4 as shared in the YouTube video?,data-engineering-zoomcamp,315ac3cc
How can I transfer multiple files from a Google Cloud Storage bucket to BigQuery?,data-engineering-zoomcamp,c5c3beba
What is the required syntax for moving several files from Google Cloud Storage to BigQuery?,data-engineering-zoomcamp,c5c3beba
Is there a special command needed to move more than one file to a BigQuery destination from Google Cloud?,data-engineering-zoomcamp,c5c3beba
What should be added in the destination folder to move multiple files from Google Cloud Storage to Big Query?,data-engineering-zoomcamp,c5c3beba
What is the file path format for transferring many files from Google Cloud to BigQuery?,data-engineering-zoomcamp,c5c3beba
What might cause SSH to fail after restarting a GCP VM?,data-engineering-zoomcamp,f19be91b
How can I resolve SSH issues on a GCP VM related to prefect?,data-engineering-zoomcamp,f19be91b
Why is SSH access unavailable on my GCP VM post-restart with prefect usage?,data-engineering-zoomcamp,f19be91b
What steps should I take if prefect affects SSH availability on my GCP VM?,data-engineering-zoomcamp,f19be91b
Can running prefect multiple times affect SSH connectivity on my VM?,data-engineering-zoomcamp,f19be91b
How can I regain SSH access to my GCP VM if access is lost due to lack of space?,data-engineering-zoomcamp,33db7dc7
What steps can I take if I receive a 'Permission denied (publickey)' error on GCP?,data-engineering-zoomcamp,33db7dc7
What should I do if I cannot connect to my GCP VM because of insufficient space?,data-engineering-zoomcamp,33db7dc7
How do I troubleshoot SSH access issues related to space on my GCP VM?,data-engineering-zoomcamp,33db7dc7
What are the steps to resolve 'Permission denied' errors on a full GCP VM?,data-engineering-zoomcamp,33db7dc7
What should I do if I get a 404 Not found error for the dataset in location us-west1?,data-engineering-zoomcamp,67ef8f87
How can I ensure that my source dataset and schema are located in the correct region in BigQuery?,data-engineering-zoomcamp,67ef8f87
Is there an alternative to removing and recreating datasets when location issues occur in BigQuery?,data-engineering-zoomcamp,67ef8f87
What steps should I follow in DBT cloud to specify the region for my dataset?,data-engineering-zoomcamp,67ef8f87
How do I update the location for my dataset in BigQuery through DBT cloud and what additional steps might be needed?,data-engineering-zoomcamp,67ef8f87
What warning is generated when running dbt run after installing dbt-utils version 1.0.0?,data-engineering-zoomcamp,6acf2e77
What is the solution if the dbt task fails due to a permission error while globbing file pattern in BigQuery?,data-engineering-zoomcamp,6acf2e77
What should be replaced in stg_green_tripdata.sql to fix the dbt_utils surrogate key deprecation error?,data-engineering-zoomcamp,6acf2e77
What roles need to be added to the service account in BigQuery to fix the access denied error?,data-engineering-zoomcamp,6acf2e77
What additional roles need to be added to the service account in GCS if a dbt task fails with access denied error?,data-engineering-zoomcamp,6acf2e77
What should I do if I encounter a dbt_utils not found error?,data-engineering-zoomcamp,18430f10
How do I resolve the error related to dbt_utils in Module 4?,data-engineering-zoomcamp,18430f10
What is the solution to the missing dbt_utils package error?,data-engineering-zoomcamp,18430f10
How can I fix the dbt_utils not found issue?,data-engineering-zoomcamp,18430f10
What steps are needed when dbt_utils cannot be located?,data-engineering-zoomcamp,18430f10
How can I fix the issue of lineage being unavailable in my dbt project?,data-engineering-zoomcamp,afb7a40a
What steps should I take if there are compilation errors in my dbt project?,data-engineering-zoomcamp,afb7a40a
Where can I find detailed error messages or warnings if my dbt build does not complete successfully?,data-engineering-zoomcamp,afb7a40a
How do I ensure my yml file is properly formatted in my dbt project?,data-engineering-zoomcamp,afb7a40a
What should I do if my dbt run fails and I need to check the build logs?,data-engineering-zoomcamp,afb7a40a
Why are there only a few days of data in my Fact_trips?,data-engineering-zoomcamp,d6a5b80e
How can I fix the issue of limited data in my Fact_trips?,data-engineering-zoomcamp,d6a5b80e
What command should I use to ensure my Fact_trips have all data?,data-engineering-zoomcamp,d6a5b80e
What variable setting should I check if my Fact_trips data is incomplete?,data-engineering-zoomcamp,d6a5b80e
How should I format the command if Fact_trips data is not fully populated?,data-engineering-zoomcamp,d6a5b80e
Why does my fact_trips data display only a single month's worth?,data-engineering-zoomcamp,de426d2f
What should I do when my fact_trips table replaces data with each monthly insertion instead of appending?,data-engineering-zoomcamp,de426d2f
How can I ensure all months' data appear in fact_trips for the years 2019 and 2020?,data-engineering-zoomcamp,de426d2f
What is the effect of setting if_exists to replace while writing data to BigQuery?,data-engineering-zoomcamp,de426d2f
How do I change my data load process to append instead of replacing existing fact_trips data?,data-engineering-zoomcamp,de426d2f
What adjustment should be made to the line after the second SELECT in the dm_monthly_zone_revenue.sql model to resolve a BigQuery error?,data-engineering-zoomcamp,354f0e10
How should the code be altered to fix an issue with the dm_monthly_zone_revenue.sql regarding date truncation?,data-engineering-zoomcamp,354f0e10
What is the correct syntax for date_trunc in the dm_monthly_zone_revenue.sql to avoid errors in BigQuery?,data-engineering-zoomcamp,354f0e10
How can I correct the date_trunc function in dm_monthly_zone_revenue.sql to ensure proper execution in BigQuery?,data-engineering-zoomcamp,354f0e10
"To fix a BigQuery error, what needs to be corrected in the date_trunc usage after the second SELECT in the model?",data-engineering-zoomcamp,354f0e10
What should be used instead of dbt_utils.surrogate_key for generating a key in Module 4?,data-engineering-zoomcamp,98fae8d0
How do you replace dbt_utils.surrogate_key in analytics engineering with dbt?,data-engineering-zoomcamp,98fae8d0
What is the correct function to substitute dbt_utils.surrogate_key in our dbt module?,data-engineering-zoomcamp,98fae8d0
Which function should replace dbt_utils.surrogate_key when working with dbt?,data-engineering-zoomcamp,98fae8d0
"In Module 4, what do we use instead of dbt_utils.surrogate_key for key generation?",data-engineering-zoomcamp,98fae8d0
What should I do if I changed the dataset location in dbt and get an error when running dbt?,data-engineering-zoomcamp,cb678fde
How can I fix a location error in dbt after relocating a dataset?,data-engineering-zoomcamp,cb678fde
What action should be taken if dbt run gives an error due to location change?,data-engineering-zoomcamp,cb678fde
How do I resolve an error in dbt run after modifying the dataset location?,data-engineering-zoomcamp,cb678fde
What is the solution for a dbt run error caused by a location change in BigQuery?,data-engineering-zoomcamp,cb678fde
Why does running dbt with specified variable values still result in a table with only 100 rows in BigQuery?,data-engineering-zoomcamp,39bfb043
What steps should I take if I get a table with incorrect row count after a dbt run?,data-engineering-zoomcamp,39bfb043
Why is a new dbt dataset appearing in BigQuery after running my CI/CD job?,data-engineering-zoomcamp,39bfb043
How can I prevent dbt from creating a new environment in BigQuery during a CI/CD job?,data-engineering-zoomcamp,39bfb043
What configurations should I check in CI/CD jobs to avoid unintended dbt environments being created?,data-engineering-zoomcamp,39bfb043
What role does the Staging dataset play in the analytics engineering process?,data-engineering-zoomcamp,351a078a
Why are datasets in staging materialized as views rather than tables?,data-engineering-zoomcamp,351a078a
"If Vic did not use the staging dataset in the project, why is it mentioned?",data-engineering-zoomcamp,351a078a
How does the Staging dataset fit between raw datasets and the final product?,data-engineering-zoomcamp,351a078a
Do we need to create the staging dataset along with production and development datasets?,data-engineering-zoomcamp,351a078a
What should I do if I serve DBT Docs but cannot access them in the browser?,data-engineering-zoomcamp,61da1919
How can I fix the issue of DBT Docs not being viewable despite being served?,data-engineering-zoomcamp,61da1919
What is the solution when DBT Docs are served but won't open in a web browser?,data-engineering-zoomcamp,61da1919
How do I resolve the problem of served DBT Docs being inaccessible online?,data-engineering-zoomcamp,61da1919
What action should I take if DBT Docs are served but inaccessible through a browser?,data-engineering-zoomcamp,61da1919
How can I resolve a 404 Not found error for a BigQuery dataset in dbt?,data-engineering-zoomcamp,6528c6ae
What steps should I follow if my BigQuery dataset is not found in europe-west6?,data-engineering-zoomcamp,6528c6ae
What should I do if my dataset is missing from the specified GCP location in BigQuery?,data-engineering-zoomcamp,6528c6ae
"If I receive a dataset not found error in BigQuery, what location setting should I check?",data-engineering-zoomcamp,6528c6ae
What actions are necessary to fix a missing dataset error and ensure it assembles in the correct location?,data-engineering-zoomcamp,6528c6ae
How can I make changes if the main branch is read-only in dbt?,data-engineering-zoomcamp,c0d3a2e8
What should I do if I need to edit a read-only main branch in dbt?,data-engineering-zoomcamp,c0d3a2e8
"Is there a way to modify the main branch directly in dbt, or should I create a new branch?",data-engineering-zoomcamp,c0d3a2e8
What steps should I take when the main branch is read-only in dbt?,data-engineering-zoomcamp,c0d3a2e8
Where can I find more information about handling a read-only main branch in dbt?,data-engineering-zoomcamp,c0d3a2e8
How can I switch from read-only mode to edit files when using dbt with git?,data-engineering-zoomcamp,859a97c5
What steps should I follow to modify files in dbt if I am in read-only mode?,data-engineering-zoomcamp,859a97c5
"When using dbt and encountering a read-only issue, how do I proceed to make changes?",data-engineering-zoomcamp,859a97c5
