question,course,document
What is the start date and time of the course?,data-engineering-zoomcamp,c02e79ef
Is there a calendar I can subscribe to for course updates?,data-engineering-zoomcamp,c02e79ef
Where can I register before the course begins?,data-engineering-zoomcamp,c02e79ef
How can I get announcements for the course?,data-engineering-zoomcamp,c02e79ef
Which platform should I join for course discussions?,data-engineering-zoomcamp,c02e79ef
Where can I find the prerequisites for this course?,data-engineering-zoomcamp,1f6520ca
What are the requirements to enroll in the course?,data-engineering-zoomcamp,1f6520ca
Could you tell me how to check the prerequisites?,data-engineering-zoomcamp,1f6520ca
Where should I look for the course prerequisites information?,data-engineering-zoomcamp,1f6520ca
How can I verify if I meet the course prerequisites?,data-engineering-zoomcamp,1f6520ca
Is it possible to enroll in the course once it has commenced?,data-engineering-zoomcamp,7842b56a
Am I able to submit assignments if I register late for the course?,data-engineering-zoomcamp,7842b56a
Can I still participate in the course if I missed the initial registration?,data-engineering-zoomcamp,7842b56a
Are there any restrictions on submitting the homework if joining late?,data-engineering-zoomcamp,7842b56a
What should I keep in mind regarding project deadlines if I enroll after the course starts?,data-engineering-zoomcamp,7842b56a
When will I receive a confirmation email for the Data Engineering Bootcamp?,data-engineering-zoomcamp,0bbf41ec
Is it necessary to wait for a registration confirmation before starting the Bootcamp?,data-engineering-zoomcamp,0bbf41ec
Do I need to register before beginning the Data Engineering Bootcamp?,data-engineering-zoomcamp,0bbf41ec
Will my participation be verified against a registered list for the Bootcamp?,data-engineering-zoomcamp,0bbf41ec
What is the purpose of registering for the Data Engineering Bootcamp if not required?,data-engineering-zoomcamp,0bbf41ec
What preparations are recommended before the course begins?,data-engineering-zoomcamp,63394d91
Which tools should I install before starting the course?,data-engineering-zoomcamp,63394d91
How can I ensure I'm ready for the course material?,data-engineering-zoomcamp,63394d91
What prerequisites should I review before the course?,data-engineering-zoomcamp,63394d91
What should I set up prior to the start of the course?,data-engineering-zoomcamp,63394d91
How many Zoom Camps are there in a year for different courses?,data-engineering-zoomcamp,2ed9b986
When does the Data-Engineering Zoomcamp take place each year?,data-engineering-zoomcamp,2ed9b986
Are there multiple live cohorts per year for the Data-Engineering Zoomcamp?,data-engineering-zoomcamp,2ed9b986
When is the MLOps Zoomcamp scheduled each year?,data-engineering-zoomcamp,2ed9b986
Can I take the Zoom camps without being part of a live cohort and at my own pace?,data-engineering-zoomcamp,2ed9b986
Will the 2024 cohort use different tools from the previous ones?,data-engineering-zoomcamp,93e2c8ed
Are there updates in tools or content between the current and previous cohorts?,data-engineering-zoomcamp,93e2c8ed
Is Mage AI replacing Prefect for the upcoming cohort?,data-engineering-zoomcamp,93e2c8ed
Have there been any changes to the terraform videos for the new cohort?,data-engineering-zoomcamp,93e2c8ed
Was Airflow used in the course prior to 2023?,data-engineering-zoomcamp,93e2c8ed
Can I continue with the materials once the course concludes?,data-engineering-zoomcamp,a482086d
Is it possible to work at my own pace after the course ends?,data-engineering-zoomcamp,a482086d
Can I still access the homeworks after the course is over?,data-engineering-zoomcamp,a482086d
Am I allowed to prepare for the next cohort using the course resources?,data-engineering-zoomcamp,a482086d
Is it feasible to start my final capstone project post-course?,data-engineering-zoomcamp,a482086d
Is there an option to get support when taking the course in a self-paced manner?,data-engineering-zoomcamp,eb56ae98
Can I still access support channels if I choose to learn at my own pace?,data-engineering-zoomcamp,eb56ae98
"If I'm studying independently, which resource should I consult first for help?",data-engineering-zoomcamp,eb56ae98
"When taking the course self-paced, how do I find out if my question has been answered already?",data-engineering-zoomcamp,eb56ae98
Does the self-paced mode offer a way to ask questions and receive assistance?,data-engineering-zoomcamp,eb56ae98
Where can I find all the main videos for the course on YouTube?,data-engineering-zoomcamp,4292531b
How can I navigate directly to the videos from the Github repository?,data-engineering-zoomcamp,4292531b
Which playlist should I look at for year-specific or additional videos?,data-engineering-zoomcamp,4292531b
Where is the MAIN playlist link available besides YouTube?,data-engineering-zoomcamp,4292531b
How can I find the main videos playlist within our Slack channel?,data-engineering-zoomcamp,4292531b
How many hours are typically needed to study this course each week?,data-engineering-zoomcamp,ea739c65
What is the expected weekly study time for this course based on experience?,data-engineering-zoomcamp,ea739c65
Can you tell me the estimated weekly time commitment for the course?,data-engineering-zoomcamp,ea739c65
"On a weekly basis, how much time should I anticipate dedicating to this course?",data-engineering-zoomcamp,ea739c65
What is the weekly hour expectation for course participants?,data-engineering-zoomcamp,ea739c65
Is it possible to obtain a certificate by completing the course on my own schedule?,data-engineering-zoomcamp,cb257ee5
Can I receive a certificate if I finish the course without a cohort?,data-engineering-zoomcamp,cb257ee5
Why can't I get a certificate in the self-paced mode?,data-engineering-zoomcamp,cb257ee5
Are certificates granted for courses completed outside the live schedule?,data-engineering-zoomcamp,cb257ee5
What are the requirements for earning a certificate in this course?,data-engineering-zoomcamp,cb257ee5
Where can students find the link to watch the Office Hour sessions live?,data-engineering-zoomcamp,04aa4897
How do students submit their questions during the Office Hour sessions?,data-engineering-zoomcamp,04aa4897
What platform should students use to watch live Office Hour streams?,data-engineering-zoomcamp,04aa4897
How are students notified about the video URL before the Office Hour sessions begin?,data-engineering-zoomcamp,04aa4897
Why should students avoid posting their questions directly in the chat during Office Hour sessions?,data-engineering-zoomcamp,04aa4897
Will recordings be available if I miss Office Hours?,data-engineering-zoomcamp,9681be3b
Are the Office Hours sessions recorded?,data-engineering-zoomcamp,9681be3b
Can I watch the Office Hours anytime?,data-engineering-zoomcamp,9681be3b
What happens if I can't attend a workshop?,data-engineering-zoomcamp,9681be3b
Is it possible to rewatch Office Hours later?,data-engineering-zoomcamp,9681be3b
Where can I check the latest for homework and project deadlines?,data-engineering-zoomcamp,a1daf537
Who should I listen for extensions or other news about deadlines?,data-engineering-zoomcamp,a1daf537
Does the form reflect the most current deadline updates by the instructor?,data-engineering-zoomcamp,a1daf537
Is there a place online where I can view all deadlines for assignments?,data-engineering-zoomcamp,a1daf537
What should I be aware of that can indicate changes in homework timing?,data-engineering-zoomcamp,a1daf537
Are you allowed to submit homework after the due date if the form remains open?,data-engineering-zoomcamp,be5bfee4
Is homework submission possible after the form has closed?,data-engineering-zoomcamp,be5bfee4
What happens if I submit homework before the form closes but after the deadline?,data-engineering-zoomcamp,be5bfee4
Do late homework submissions get accepted?,data-engineering-zoomcamp,be5bfee4
Can you confirm homework submission after the due date by checking the Course page timestamp?,data-engineering-zoomcamp,be5bfee4
Where can I find the URL for submitting homework?,data-engineering-zoomcamp,0e424a44
What should be included in the homework URL?,data-engineering-zoomcamp,0e424a44
In what location should I store my homework code?,data-engineering-zoomcamp,0e424a44
What platform should my homework repository be on?,data-engineering-zoomcamp,0e424a44
How can someone verify that I completed weekly exercises?,data-engineering-zoomcamp,0e424a44
How are homework assignments graded in terms of points?,data-engineering-zoomcamp,29865466
Where can I find the total sum of points I've earned?,data-engineering-zoomcamp,29865466
"What points can be earned aside from homework, and how are these calculated?",data-engineering-zoomcamp,29865466
How many points will I receive for submitting to the FAQ?,data-engineering-zoomcamp,29865466
What is the point allocation for contributing a learning in public link?,data-engineering-zoomcamp,29865466
How can I check my position on the leaderboard for the course?,data-engineering-zoomcamp,016d46a1
Where should I go to find out my display name used in the course leaderboard?,data-engineering-zoomcamp,016d46a1
What steps should I follow to see my random name assigned for the leaderboard?,data-engineering-zoomcamp,016d46a1
Is there a way to see and change my display name on the course leaderboard?,data-engineering-zoomcamp,016d46a1
How does the course assign a name to me for the leaderboard display?,data-engineering-zoomcamp,016d46a1
Is Python 3.9 recommended for this course in 2024?,data-engineering-zoomcamp,47972cb1
Should students use Python 3.9 to avoid troubleshooting issues with videos?,data-engineering-zoomcamp,47972cb1
Will Python 3.10 work for this course despite Python 3.9 being recommended?,data-engineering-zoomcamp,47972cb1
Does the course support using Python 3.11?,data-engineering-zoomcamp,47972cb1
Why is Python 3.9 still suggested for simplicity and stability?,data-engineering-zoomcamp,47972cb1
Is it recommended to use a local machine or a virtual machine like GCP or GitHub Codespaces for the course environment?,data-engineering-zoomcamp,ddf6c1b3
"What challenges might arise if I use my local machine, particularly if it's running Windows?",data-engineering-zoomcamp,ddf6c1b3
How should I begin if I want to set up my environment on my local machine?,data-engineering-zoomcamp,ddf6c1b3
What are the first steps if I choose to use a virtual machine for my setup?,data-engineering-zoomcamp,ddf6c1b3
Why might someone prefer a virtual machine over a local machine for this course?,data-engineering-zoomcamp,ddf6c1b3
Is it possible to use GitHub Codespaces instead of CLI or Git Bash for data ingestion and Docker file creation?,data-engineering-zoomcamp,ac25d3af
What resources does GitHub Codespaces provide for computing?,data-engineering-zoomcamp,ac25d3af
Can I open a repository directly in GitHub Codespaces?,data-engineering-zoomcamp,ac25d3af
Does GitHub Codespaces come with pre-installed tools?,data-engineering-zoomcamp,ac25d3af
Are Docker and Docker Compose available in GitHub Codespaces?,data-engineering-zoomcamp,ac25d3af
Is it mandatory to use GitHub Codespaces for this course?,data-engineering-zoomcamp,251218fc
Can I complete the course on my personal laptop?,data-engineering-zoomcamp,251218fc
Are platforms like GCP VM just optional?,data-engineering-zoomcamp,251218fc
Do I need to use a specific development environment?,data-engineering-zoomcamp,251218fc
Is it possible to use my own installation of PostgreSQL and Docker?,data-engineering-zoomcamp,251218fc
Is it necessary to use both GitHub Codespaces and GCP for this course?,data-engineering-zoomcamp,3c0114ce
"Which environment is recommended, GitHub Codespaces or GCP, for the final project?",data-engineering-zoomcamp,3c0114ce
Can I set up a local environment instead of using GitHub Codespaces or GCP?,data-engineering-zoomcamp,3c0114ce
How important is it to learn BigQuery for the course?,data-engineering-zoomcamp,3c0114ce
Is using GCP essential due to BigQuery's involvement in the course?,data-engineering-zoomcamp,3c0114ce
How do I open the Run command window on a Windows computer?,data-engineering-zoomcamp,f43f5fe7
What is the shortcut key combination to open the Run window?,data-engineering-zoomcamp,f43f5fe7
How can I access the Registry Editor on a Windows machine?,data-engineering-zoomcamp,f43f5fe7
Where can I find the 'Autorun' registry value to change it?,data-engineering-zoomcamp,f43f5fe7
Where is the known_hosts file located on a Windows system?,data-engineering-zoomcamp,f43f5fe7
Why are we encouraged to use GCP for the course instead of other providers like AWS?,data-engineering-zoomcamp,d061525d
Is it possible to use Azure or other cloud platforms instead of GCP for the course?,data-engineering-zoomcamp,d061525d
What benefits does GCP offer to new users that might influence its use in the course?,data-engineering-zoomcamp,d061525d
Can you explain why having a Google account is advantageous for the course?,data-engineering-zoomcamp,d061525d
"Is a credit card necessary to sign up for the free GCP trial, and why?",data-engineering-zoomcamp,d061525d
Is there a cost associated with cloud services during the course?,data-engineering-zoomcamp,1cd01b2c
Do I need to pay to access GCP services as a student in this course?,data-engineering-zoomcamp,1cd01b2c
Are there any expenses for using GCP during this course?,data-engineering-zoomcamp,1cd01b2c
Will there be any charges for cloud services while enrolled in this course?,data-engineering-zoomcamp,1cd01b2c
Is it necessary to pay for cloud service access in the course?,data-engineering-zoomcamp,1cd01b2c
Is it feasible to complete the course without access to Google Cloud Platform or other cloud services?,data-engineering-zoomcamp,e4a7c3b0
Can I perform all the course activities locally if cloud services like BigQuery are unavailable?,data-engineering-zoomcamp,e4a7c3b0
Will I receive support or guidelines for setting up a home lab to work without cloud providers?,data-engineering-zoomcamp,e4a7c3b0
Are there local alternatives for every tool and service used in the course?,data-engineering-zoomcamp,e4a7c3b0
Is it necessary to use GCP to successfully finish the course?,data-engineering-zoomcamp,e4a7c3b0
Is it possible for me to utilize AWS for this course's projects and assignments?,data-engineering-zoomcamp,7cd1912e
What should I keep in mind while using AWS instead of GCP for the course?,data-engineering-zoomcamp,7cd1912e
Will there be any issues in receiving assistance if I choose AWS over GCP?,data-engineering-zoomcamp,7cd1912e
What aspect(s) will the final capstone evaluation focus on?,data-engineering-zoomcamp,7cd1912e
Where can I find peers who might provide AWS-specific assistance?,data-engineering-zoomcamp,7cd1912e
Will there be additional live session opportunities besides office hours?,data-engineering-zoomcamp,52393fb3
Are there plans for any live calls apart from the scheduled office hours?,data-engineering-zoomcamp,52393fb3
Can I expect more live zoom meetings during the course?,data-engineering-zoomcamp,52393fb3
Will there be live calls during the capstone that aren't office hours?,data-engineering-zoomcamp,52393fb3
Will any extra live sessions be announced in advance?,data-engineering-zoomcamp,52393fb3
Are we continuing to utilize the NYC Trip data from January 2021 for our project?,data-engineering-zoomcamp,10515af5
Has the data set for the project been updated to the 2022 NYC Trip information?,data-engineering-zoomcamp,10515af5
Is the data for our course project still the same as last year’s NYC Trip data?,data-engineering-zoomcamp,10515af5
Will our course project involve analyzing the NYC Trip data from January 2021?,data-engineering-zoomcamp,10515af5
Should we access the same NYC Trip data as the previous year for our project work?,data-engineering-zoomcamp,10515af5
Is the 2022 repository still available?,data-engineering-zoomcamp,cdb86a97
Have the 2022 materials been relocated?,data-engineering-zoomcamp,cdb86a97
Has the 2022 repo been removed?,data-engineering-zoomcamp,cdb86a97
Are the 2022 course resources just moved?,data-engineering-zoomcamp,cdb86a97
Is the 2022 repo no longer accessible?,data-engineering-zoomcamp,cdb86a97
Is it possible to select a different tool for my project?,data-engineering-zoomcamp,3e0114ad
Am I allowed to choose a custom tool for the course project?,data-engineering-zoomcamp,3e0114ad
Can I opt for a different tool for completing my project?,data-engineering-zoomcamp,3e0114ad
Is there flexibility in choosing tools for the final project?,data-engineering-zoomcamp,3e0114ad
May I pick any tool for my final course assignment?,data-engineering-zoomcamp,3e0114ad
Can I use Airflow instead of the tool you are using in the course?,data-engineering-zoomcamp,b2799574
Is it acceptable to choose Tableau over Metabase for the course?,data-engineering-zoomcamp,b2799574
Am I allowed to replace AWS with GCP products while following the course?,data-engineering-zoomcamp,b2799574
"If I opt for a different data stack, will I receive support during the course?",data-engineering-zoomcamp,b2799574
Do I have to explain my choice of tools in the capstone project peer review?,data-engineering-zoomcamp,b2799574
How can we help improve the course content?,data-engineering-zoomcamp,2f19301f
What actions are encouraged if we find the course useful?,data-engineering-zoomcamp,2f19301f
In what ways can students participate in enhancing the course material?,data-engineering-zoomcamp,2f19301f
What should I do if I spot areas for improvement in the repository?,data-engineering-zoomcamp,2f19301f
How can students support the visibility and reach of the course?,data-engineering-zoomcamp,2f19301f
Is it possible to use a Mac for this course?,data-engineering-zoomcamp,7c700adb
Can I participate in the course using Windows?,data-engineering-zoomcamp,7c700adb
Will this course work on a Linux system?,data-engineering-zoomcamp,7c700adb
Is the course compatible with multiple operating systems?,data-engineering-zoomcamp,7c700adb
Are students expected to use a specific OS for this course?,data-engineering-zoomcamp,7c700adb
What issues might Windows users encounter with shell scripts in later modules like module-05 and the RisingWave workshop?,data-engineering-zoomcamp,44b14808
Why is setting up a WSL environment recommended for Windows users from the beginning of the course?,data-engineering-zoomcamp,44b14808
How can Windows users overcome the limitations of git bash or MINGW64 when dealing with shell scripts?,data-engineering-zoomcamp,44b14808
Are there any existing resources or past solutions available for Windows users encountering problems with *.sh shell scripts?,data-engineering-zoomcamp,44b14808
What might be the challenges Windows users face if they do not use WSL for modules requiring shell scripts?,data-engineering-zoomcamp,44b14808
What extra materials should I consult during the course?,data-engineering-zoomcamp,76e4baf6
Are there any recommended books for the course?,data-engineering-zoomcamp,76e4baf6
Where can I find additional resources for this class?,data-engineering-zoomcamp,76e4baf6
Is there a document with suggested reading for this program?,data-engineering-zoomcamp,76e4baf6
Can you guide me to useful resources for this course?,data-engineering-zoomcamp,76e4baf6
What happens if I miss the first project deadline?,data-engineering-zoomcamp,48b533a8
How many times can I submit a project?,data-engineering-zoomcamp,48b533a8
"If I fail the first project submission, is there another chance?",data-engineering-zoomcamp,48b533a8
Is there a second opportunity for late project submissions?,data-engineering-zoomcamp,48b533a8
What does having two project attempts mean?,data-engineering-zoomcamp,48b533a8
What should be my first step when I encounter an issue in the course?,data-engineering-zoomcamp,954044d1
Can you give an example of how to search for solutions using Google or Bing AI?,data-engineering-zoomcamp,954044d1
What kind of information should I include when posting a question on Stackoverflow?,data-engineering-zoomcamp,954044d1
Why is it a bad practice to use screenshots when asking for help?,data-engineering-zoomcamp,954044d1
What non-technical strategies can help if I am stuck on a problem?,data-engineering-zoomcamp,954044d1
When should I ask for help if the troubleshooting guide doesn't solve my issue?,data-engineering-zoomcamp,a820b9b3
What information should I include about my coding environment when asking a question?,data-engineering-zoomcamp,a820b9b3
What specific details about a command or video should I mention when I seek help?,data-engineering-zoomcamp,a820b9b3
Why is it important to mention the errors I received and any line numbers when asking for assistance?,data-engineering-zoomcamp,a820b9b3
Why should I share what I've already attempted that didn't work when asking for help?,data-engineering-zoomcamp,a820b9b3
What steps should I follow after creating a GitHub account for the course?,data-engineering-zoomcamp,f2945cd2
How can I easily access the instructors’ code on my local machine?,data-engineering-zoomcamp,f2945cd2
Where can I find a tutorial for setting up my own Git repository?,data-engineering-zoomcamp,f2945cd2
What types of files should I avoid saving in a GitHub repository?,data-engineering-zoomcamp,f2945cd2
Why is it important not to store passwords in a Git repo?,data-engineering-zoomcamp,f2945cd2
What error might occur if the wrong whitespace is used in a Makefile when using VS Code?,data-engineering-zoomcamp,eb9d376f
How can the 'missing separator' error be resolved in a Makefile?,data-engineering-zoomcamp,eb9d376f
What should be converted in a document to fix an error with separators in VS Code?,data-engineering-zoomcamp,eb9d376f
"In VS Code, what needs to be changed to tabs to solve a Makefile error?",data-engineering-zoomcamp,eb9d376f
What causes the 'Makefile:2: *** missing separator. Stop.' issue in VS Code?,data-engineering-zoomcamp,eb9d376f
How can I open an HTML file from WSL Linux using a Windows browser?,data-engineering-zoomcamp,72f25f6d
What tool do I need to install to open Linux HTML files on a Windows browser through WSL?,data-engineering-zoomcamp,72f25f6d
What command should I use to open an HTML page with a browser in WSL 2?,data-engineering-zoomcamp,72f25f6d
How do I set a specific browser to open HTML files in WSL?,data-engineering-zoomcamp,72f25f6d
Where do I find the command to restrict a browser choice for opening files from WSL?,data-engineering-zoomcamp,72f25f6d
What steps should I follow to set up the Chrome Remote Desktop on a Debian Linux VM on Compute Engine?,data-engineering-zoomcamp,a1e59afc
What should I do if I encounter a 403 Forbidden error when trying to download the 2021 Yellow Taxi Trip Records from the TLC website?,data-engineering-zoomcamp,a1e59afc
Where can I find the backup link for downloading the 2021 Yellow Taxi trip data?,data-engineering-zoomcamp,a1e59afc
How should I properly unzip the Yellow Taxi trip data gz file if the unzip command does not work?,data-engineering-zoomcamp,a1e59afc
What is Chrome Remote Desktop and what is its use on a Compute Engine instance?,data-engineering-zoomcamp,a1e59afc
How can we correctly store taxi data files now that they are available as *.csv.gz?,data-engineering-zoomcamp,71c10610
What should we replace csv_name with if the file extension is csv.gz and not csv?,data-engineering-zoomcamp,71c10610
Is there an issue using pandas read_csv with files that have a csv.gz extension?,data-engineering-zoomcamp,71c10610
How can the file name be determined when downloading taxi data from a URL?,data-engineering-zoomcamp,71c10610
Why won't the taxi data file store correctly if the extension is csv.gz instead of csv?,data-engineering-zoomcamp,71c10610
Where can I find the data dictionary for Yellow Taxi trip records?,data-engineering-zoomcamp,17a5aea1
What is the URL for the data dictionary of Green Taxi trips?,data-engineering-zoomcamp,17a5aea1
How can I access the data dictionary specifically for yellow taxi trips?,data-engineering-zoomcamp,17a5aea1
Could you provide a link to the data dictionary for Green Taxi data?,data-engineering-zoomcamp,17a5aea1
Where is the data dictionary for Yellow Trips documentation located?,data-engineering-zoomcamp,17a5aea1
How can we unzip a parquet file to convert it to a CSV format using command line?,data-engineering-zoomcamp,5a275db7
What line should be added to the ingest_data.py script to handle parquet files directly?,data-engineering-zoomcamp,5a275db7
Which command is used to download a file and rename it to output.parquet within a Python script?,data-engineering-zoomcamp,5a275db7
How do we convert a parquet file to a CSV in the given solution?,data-engineering-zoomcamp,5a275db7
In which format should the downloaded file be renamed to keep it consistent with the rest of the code?,data-engineering-zoomcamp,5a275db7
What should I do if wget is not recognized as a command on Ubuntu?,data-engineering-zoomcamp,7ec0f9b0
How can I install wget on MacOS if it is not recognized as a command?,data-engineering-zoomcamp,7ec0f9b0
What are the steps to install wget on Windows if it is not recognized as an internal or external command?,data-engineering-zoomcamp,7ec0f9b0
Is there an alternative method to use wget functionality via Python?,data-engineering-zoomcamp,7ec0f9b0
How can I download a file if wget is not available?,data-engineering-zoomcamp,7ec0f9b0
What should I do if I see an error related to verifying a certificate on MacOS when using wget?,data-engineering-zoomcamp,bb1ba786
How can I run a wget command in a Jupyter Notebook?,data-engineering-zoomcamp,bb1ba786
What alternative command can be used in CLI for wget if there is a certificate verification error?,data-engineering-zoomcamp,bb1ba786
