question,course,document
What is an error encountered when trying to connect to Git on Saturn Cloud?,machine-learning-zoomcamp,dd3c8000
What can cause the 'Permission denied (publickey)' error when setting up Git in Saturn Cloud?,machine-learning-zoomcamp,dd3c8000
How can I resolve the Git connection issue on Saturn Cloud mentioned in module 8.1b?,machine-learning-zoomcamp,dd3c8000
What are the steps to generate an SSH key for Git access on Saturn Cloud?,machine-learning-zoomcamp,dd3c8000
Where can I find detailed instructions for setting up Git in Saturn Cloud?,machine-learning-zoomcamp,dd3c8000
What should I do if I encounter a host key verification failure when trying to clone a GitHub repository?,machine-learning-zoomcamp,34b0ebfc
How can I resolve the issue of not being able to read from a remote repository due to host key verification failure?,machine-learning-zoomcamp,34b0ebfc
Is there an alternative method for cloning a repository if I get an SSH error related to host key verification?,machine-learning-zoomcamp,34b0ebfc
"What might cause a host key verification failure when using git clone, and how can I fix it?",machine-learning-zoomcamp,34b0ebfc
"Why am I unable to clone a repository due to host key verification failure, and what is a workaround?",machine-learning-zoomcamp,34b0ebfc
What should I do if the accuracy and the loss remain nearly identical during training?,machine-learning-zoomcamp,7d11d5ce
How can I ensure correct data reading for the homework?,machine-learning-zoomcamp,7d11d5ce
What might cause the accuracy and loss to stay the same in a model?,machine-learning-zoomcamp,7d11d5ce
Which parameter might be incorrect if training results do not improve?,machine-learning-zoomcamp,7d11d5ce
Who provided the solution for dealing with constant accuracy and loss in training?,machine-learning-zoomcamp,7d11d5ce
What should I check if my model has high loss and low accuracy after resuming training with augmentation?,machine-learning-zoomcamp,e4e45f15
Why does my model's performance drop to random levels after I apply augmentation?,machine-learning-zoomcamp,e4e45f15
How can I fix the issue of my model breaking with high loss and low accuracy following augmentation?,machine-learning-zoomcamp,e4e45f15
What is a potential solution if training after augmentation results in accuracy around 0.5?,machine-learning-zoomcamp,e4e45f15
What step should I revisit if my model's loss increases to 1000+ when using augmentation?,machine-learning-zoomcamp,e4e45f15
What should I do if I encounter a ValueError related to channel dimension when reloading a saved model in TensorFlow?,machine-learning-zoomcamp,b3997e6f
How can I resolve the issue where the channel dimension is undefined when loading my saved neural network model?,machine-learning-zoomcamp,b3997e6f
Why do I get an error about an undefined channel dimension when I load my model saved using model.save()?,machine-learning-zoomcamp,b3997e6f
What changes should I make to my model architecture to avoid ValueError related to channel dimension upon reloading?,machine-learning-zoomcamp,b3997e6f
How can specifying the number of channels in the Input layer help when dealing with model reloading issues?,machine-learning-zoomcamp,b3997e6f
How can I unzip an image dataset folder inside a Jupyter notebook without displaying all the output messages?,machine-learning-zoomcamp,e414df91
What is the method to suppress the output when unzipping a folder using the ! unzip command?,machine-learning-zoomcamp,e414df91
Is there a way to prevent the verbose messages while unzipping files in a Jupyter notebook?,machine-learning-zoomcamp,e414df91
What steps should I follow to unzip a dataset and avoid the output flood within Jupyter?,machine-learning-zoomcamp,e414df91
How do I use Python code to extract files from a zipped dataset with no unzipping output?,machine-learning-zoomcamp,e414df91
How does flow_from_directory determine class names in images for training?,machine-learning-zoomcamp,f20a3479
Can folder names directly influence the classification process in Keras?,machine-learning-zoomcamp,f20a3479
Is there an underlying mechanism in flow_from_directory to identify class names?,machine-learning-zoomcamp,f20a3479
Does creating a folder with any name automatically create a new class in Keras?,machine-learning-zoomcamp,f20a3479
Where can I find a detailed explanation on image classification with flow_from_directory?,machine-learning-zoomcamp,f20a3479
What should I do if I encounter a missing scipy module error in SaturnCloud?,machine-learning-zoomcamp,e7af4968
How can I resolve an error associated with the scipy module in a SaturnCloud environment?,machine-learning-zoomcamp,e7af4968
What is the solution for a missing scipy module error after creating a new environment in SaturnCloud?,machine-learning-zoomcamp,e7af4968
How do I fix a missing scipy module error when using Saturn with Tensorflow in SaturnCloud?,machine-learning-zoomcamp,e7af4968
What steps should I take if my SaturnCloud environment throws an error due to a missing scipy module?,machine-learning-zoomcamp,e7af4968
How does tensorflow's flow_from_directory determine numeric class labels using binary class mode?,machine-learning-zoomcamp,9fad096e
What order are folders read in when using flow_from_directory with binary class mode?,machine-learning-zoomcamp,9fad096e
How does a Keras binary model predict class labels with sigmoid activation?,machine-learning-zoomcamp,9fad096e
What probability does Keras return for class 1 using binary prediction?,machine-learning-zoomcamp,9fad096e
How can one find the probability of class 0 in a Keras model using binary classification?,machine-learning-zoomcamp,9fad096e
Do small changes in predictions from neural networks matter?,machine-learning-zoomcamp,bcdf7407
Are slight alterations acceptable in neural network predictions?,machine-learning-zoomcamp,bcdf7407
Should minor prediction changes be expected with neural networks?,machine-learning-zoomcamp,bcdf7407
Is it normal for neural network predictions to exhibit small variances?,machine-learning-zoomcamp,bcdf7407
Can small modifications in neural network outputs be considered normal?,machine-learning-zoomcamp,bcdf7407
What could cause discrepancies in reported accuracy and std deviation when running the wasp/bee model on a mac laptop compared to HW answers?,machine-learning-zoomcamp,8d1e7e20
What might be the reason for seeing differences in results on a mac laptop due to the SGD optimizer?,machine-learning-zoomcamp,8d1e7e20
What should be done if the model accuracy and std training loss do not match the HW provided answers?,machine-learning-zoomcamp,8d1e7e20
Which platform could provide similar results for the wasp/bee model as compared to the HW answers?,machine-learning-zoomcamp,8d1e7e20
What change in runtime is suggested to improve model speed when not using a CPU?,machine-learning-zoomcamp,8d1e7e20
How can I speed up data loading in model.fit()?,machine-learning-zoomcamp,2023a9dc
What does the workers parameter in model.fit() do?,machine-learning-zoomcamp,2023a9dc
What default value is set for workers in model.fit()?,machine-learning-zoomcamp,2023a9dc
How should I determine the best workers value for model.fit()?,machine-learning-zoomcamp,2023a9dc
Who contributed the information about model.fit() in the FAQ?,machine-learning-zoomcamp,2023a9dc
How can I ensure reproducibility in TensorFlow scripts?,machine-learning-zoomcamp,468f69ff
What is the method to achieve deterministic outputs in TensorFlow?,machine-learning-zoomcamp,468f69ff
Could you provide the steps for setting a seed in TensorFlow for consistent results?,machine-learning-zoomcamp,468f69ff
What functions should I use to set a random seed in TensorFlow?,machine-learning-zoomcamp,468f69ff
How do I execute a TensorFlow script multiple times with the same results?,machine-learning-zoomcamp,468f69ff
Is it possible to use a framework other than Keras for the neural networks and deep learning section?,machine-learning-zoomcamp,c4ff26e5
Are there tutorials available for building CNNs from scratch using other libraries?,machine-learning-zoomcamp,c4ff26e5
Can I submit my assignments using a different deep learning library?,machine-learning-zoomcamp,c4ff26e5
Where can I find a guide to implement CNNs using Pytorch?,machine-learning-zoomcamp,c4ff26e5
Does Pytorch offer similar functionalities for neural network tasks as Keras?,machine-learning-zoomcamp,c4ff26e5
What might cause a Keras training process to fail with a data adapter error?,machine-learning-zoomcamp,62722d72
Why would a Keras model give an error about finding a data adapter when using ImageDataGenerator?,machine-learning-zoomcamp,62722d72
What adjustment should be made if there's a 'Failed to find data adapter' error during Keras training?,machine-learning-zoomcamp,62722d72
How do you resolve the 'Failed to find data adapter' issue when training a Keras model with ImageDataGenerator?,machine-learning-zoomcamp,62722d72
What is the common mistake leading to a Keras model failing due to a data adapter issue?,machine-learning-zoomcamp,62722d72
How can I run 'nvidia-smi' to refresh automatically without 'watch' command?,machine-learning-zoomcamp,d1419be1
What is the purpose of the '-l' option in the 'nvidia-smi' command?,machine-learning-zoomcamp,d1419be1
How can you execute 'nvidia-smi' to update every few seconds?,machine-learning-zoomcamp,d1419be1
Who contributed to the solution for running 'nvidia-smi' in a loop?,machine-learning-zoomcamp,d1419be1
What command updates 'nvidia-smi' every 2 seconds without 'watch'?,machine-learning-zoomcamp,d1419be1
How can we check GPU utilization interactively?,machine-learning-zoomcamp,a5f6f439
What tool is similar to 'htop' for GPUs?,machine-learning-zoomcamp,a5f6f439
Who added the information about checking GPU utilization?,machine-learning-zoomcamp,a5f6f439
Where can we find more information about the Python package?,machine-learning-zoomcamp,a5f6f439
What is the purpose of the Python package mentioned?,machine-learning-zoomcamp,a5f6f439
How is the number of parameters in the Conv2d layer calculated?,machine-learning-zoomcamp,879c1ec0
"What is the relationship between the kernel, channels, and filters in the Conv2d layer's parameters?",machine-learning-zoomcamp,879c1ec0
How do you determine the number of features after the Flatten layer?,machine-learning-zoomcamp,879c1ec0
"What does 'None, 148, 148, 32' represent in the model summary for the Conv2d layer?",machine-learning-zoomcamp,879c1ec0
How is the output shape of 6272 features computed after the Flatten layer?,machine-learning-zoomcamp,879c1ec0
What is the easier mode to use when building a model with Keras?,machine-learning-zoomcamp,3ac604c3
Why might it be beneficial to use the Functional Model API in Keras?,machine-learning-zoomcamp,3ac604c3
How should I proceed if I encounter an error in my neural network architecture?,machine-learning-zoomcamp,3ac604c3
What is the basic structure of models discussed in the course?,machine-learning-zoomcamp,3ac604c3
Where can I find a useful Sequential model example?,machine-learning-zoomcamp,3ac604c3
What code snippet can help fix out of memory errors with TensorFlow on an Nvidia GPU?,machine-learning-zoomcamp,0315aa96
Is there a way to address out of memory errors on a CPU when using TensorFlow?,machine-learning-zoomcamp,0315aa96
Where can I find the API documentation for the code to resolve memory errors with TensorFlow?,machine-learning-zoomcamp,0315aa96
What is the purpose of the 'set_memory_growth' feature in TensorFlow?,machine-learning-zoomcamp,0315aa96
Does the provided code snippet handle errors when the device can't be modified?,machine-learning-zoomcamp,0315aa96
Why is the model training so slow using the T4 GPU in Google Colab?,machine-learning-zoomcamp,daf84bc3
How can I improve model training speed on a T4 GPU in Google Colab?,machine-learning-zoomcamp,daf84bc3
What is the default value for workers in the fit function when training models?,machine-learning-zoomcamp,daf84bc3
Where can I find instructions for optimizing the number of workers for a T4 GPU?,machine-learning-zoomcamp,daf84bc3
Who provided the solution for slow model training using the T4 GPU in Google Colab?,machine-learning-zoomcamp,daf84bc3
What is the recommended method for loading images instead of using ImageDataGenerator?,machine-learning-zoomcamp,1e956ca7
Why is ImageDataGenerator not suggested for new code?,machine-learning-zoomcamp,1e956ca7
What function from keras should be used to load images?,machine-learning-zoomcamp,1e956ca7
Where can I find more information about image loading and augmentation?,machine-learning-zoomcamp,1e956ca7
Who provided this information on image loading methods?,machine-learning-zoomcamp,1e956ca7
What initial steps should be taken to begin Week 9 activities?,machine-learning-zoomcamp,3ee083ab
How do I initiate the learning process for the ninth week?,machine-learning-zoomcamp,3ee083ab
What are the starting guidelines for Week 9 in the course?,machine-learning-zoomcamp,3ee083ab
Where should I start for the tasks outlined in Week 9?,machine-learning-zoomcamp,3ee083ab
What should I do first to embark on Week 9's lessons?,machine-learning-zoomcamp,3ee083ab
Where can I find the model for week 9 in the course?,machine-learning-zoomcamp,f826cba4
Is there a specific location or link for the week 9 model?,machine-learning-zoomcamp,f826cba4
Has the original link for the week 9 model been updated or moved?,machine-learning-zoomcamp,f826cba4
Can you provide the updated link for accessing the week 9 models?,machine-learning-zoomcamp,f826cba4
What is the new URL for fetching the models used in week 9?,machine-learning-zoomcamp,f826cba4
Why does the command echo ${REMOTE_URI} not return anything when I try it in my terminal?,machine-learning-zoomcamp,60fa95ed
How can I make REMOTE_URI output my URI address in the terminal?,machine-learning-zoomcamp,60fa95ed
What should I do if the REMOTE_URI variable doesn't persist after session termination?,machine-learning-zoomcamp,60fa95ed
What is the correct format for the command echo to output the REMOTE_URI in the terminal?,machine-learning-zoomcamp,60fa95ed
How do I ensure my REMOTE_URI is set correctly for logging into the registry?,machine-learning-zoomcamp,60fa95ed
What error might you encounter when using aws ecr get-login with the no-include-email option?,machine-learning-zoomcamp,53f3ee10
How can you resolve the invalid choice error when attempting to get a password with aws-cli?,machine-learning-zoomcamp,53f3ee10
What command should replace aws ecr get-login to prevent a syntax error?,machine-learning-zoomcamp,53f3ee10
Is there a way to simplify the login process to the AWS ECR repository and what placeholders need to be customized?,machine-learning-zoomcamp,53f3ee10
Who contributed the solution for resolving the aws-cli password retrieval error?,machine-learning-zoomcamp,53f3ee10
How can I efficiently pass multiple parameters to a CNN model?,machine-learning-zoomcamp,93aa4278
What function allows passing many parameters in serverless deep learning?,machine-learning-zoomcamp,93aa4278
Which Keras function handles multiple parameters at once for CNNs?,machine-learning-zoomcamp,93aa4278
Is there a way to manage multiple CNN parameters simultaneously?,machine-learning-zoomcamp,93aa4278
How do I pass numerous model parameters in a concise manner?,machine-learning-zoomcamp,93aa4278
What error message might appear when building a Docker image from the Amazon Python base image?,machine-learning-zoomcamp,0edeb016
How can I resolve the issue of getting an error during Docker image build from a Python base image?,machine-learning-zoomcamp,0edeb016
What should I do first if I haven’t updated Docker Desktop to solve a Docker image build error?,machine-learning-zoomcamp,0edeb016
What is a potential final step if restarting Docker does not fix the build error?,machine-learning-zoomcamp,0edeb016
Who added the optional solution to the Docker build error question?,machine-learning-zoomcamp,0edeb016
What command can I use as an alternative to 'ls' in Windows Jupyter Notebook?,machine-learning-zoomcamp,ba186de6
How can I handle the 'ls' command error in Windows for Jupyter Notebook?,machine-learning-zoomcamp,ba186de6
What should I do when 'ls' is not recognized in Windows Jupyter Notebook?,machine-learning-zoomcamp,ba186de6
Is there a Windows equivalent command for '!ls -lh' in Jupyter Notebook?,machine-learning-zoomcamp,ba186de6
What is the solution if 'ls' fails to execute in Windows for Jupyter Notebook?,machine-learning-zoomcamp,ba186de6
What should I do to resolve the ImportError regarding the InterpreterWrapper type registration?,machine-learning-zoomcamp,da2f1cf4
How do I fix the ImportError that occurs with tflite_runtime.interpreter and tensorflow imports?,machine-learning-zoomcamp,da2f1cf4
Why do I encounter an error about 'InterpreterWrapper' being registered when using tflite_runtime.interpreter?,machine-learning-zoomcamp,da2f1cf4
What steps are necessary to address the ImportError with tflite_runtime.interpreter in my notebook?,machine-learning-zoomcamp,da2f1cf4
What causes the type 'InterpreterWrapper' error when using both tensorflow and tflite_runtime.interpreter?,machine-learning-zoomcamp,da2f1cf4
What should I do if I encounter an error stating that the Windows version might not be up-to-date when building a Docker image?,machine-learning-zoomcamp,7fd648ca
How can I troubleshoot the error message indicating that the Docker daemon is not running?,machine-learning-zoomcamp,7fd648ca
What does the warning about the Windows version not being up-to-date mean when using Docker?,machine-learning-zoomcamp,7fd648ca
What could be preventing Docker from connecting during a build on Windows?,machine-learning-zoomcamp,7fd648ca
How can I ensure that Docker is not interfered with by external programs when running commands?,machine-learning-zoomcamp,7fd648ca
Why do I encounter an error during docker build -t dino-dragon-model related to pip version?,machine-learning-zoomcamp,42c09143
What could cause errors related to Python versions shown in Alex's video this week?,machine-learning-zoomcamp,42c09143
How can using the incorrect link result in the same pip version warning error?,machine-learning-zoomcamp,42c09143
Which wheel version should we use to avoid the pip error mentioned in the course?,machine-learning-zoomcamp,42c09143
Where can I find the correct raw format link to download the required wheel file?,machine-learning-zoomcamp,42c09143
What should I enter for the Default output format after installing awscli?,machine-learning-zoomcamp,d6d534fc
Is it acceptable to leave the Default output format as None when configuring awscli?,machine-learning-zoomcamp,d6d534fc
What are the necessary details to provide when running aws configure?,machine-learning-zoomcamp,d6d534fc
Should I use the default values for aws configure settings after awscli installation?,machine-learning-zoomcamp,d6d534fc
What settings did Bhaskar Sarma use for Default output format during aws configure?,machine-learning-zoomcamp,d6d534fc
What error occurs when a lambda function's input in Docker has float32 values?,machine-learning-zoomcamp,b2c0c554
How can numpy float32 values be made JSON serializable in a lambda function?,machine-learning-zoomcamp,b2c0c554
What change should be made in the function predict() to fix the JSON serialization error?,machine-learning-zoomcamp,b2c0c554
Which chapters should be followed to resolve the float32 serialization issue?,machine-learning-zoomcamp,b2c0c554
Who added the information about the serialization issue in the deep learning FAQ?,machine-learning-zoomcamp,b2c0c554
"What is the solution to the error encountered when the code interpreter.set_tensor(input_index, x) is executed?",machine-learning-zoomcamp,819afebc
Why does the error 'Cannot set tensor: Got value of type UINT8 but expected type FLOAT32' occur according to section 9.3?,machine-learning-zoomcamp,819afebc
What type conversion is needed to fix the ValueError mentioned in the course FAQ?,machine-learning-zoomcamp,819afebc
Could the version of TensorFlow used impact the occurrence of the ValueError in serverless deep learning?,machine-learning-zoomcamp,819afebc
Where can I find additional information on resolving the ValueError when setting a tensor in TensorFlow?,machine-learning-zoomcamp,819afebc
How can I determine file size using PowerShell commands?,machine-learning-zoomcamp,74551c54
What is the process to find a file's size on a PowerShell terminal?,machine-learning-zoomcamp,74551c54
Could you explain the PowerShell steps to get a file's size in megabytes?,machine-learning-zoomcamp,74551c54
What specific commands can help in checking the size of a file with PowerShell?,machine-learning-zoomcamp,74551c54
Where can I find more information on obtaining file size using PowerShell?,machine-learning-zoomcamp,74551c54
What resources can help me understand the workings of Lambda container images?,machine-learning-zoomcamp,4d98cd09
Where can I find detailed information on the initialization of lambda functions?,machine-learning-zoomcamp,4d98cd09
Who contributed the links to further understand lambda container images?,machine-learning-zoomcamp,4d98cd09
Which documents should I refer to for creating Lambda container images?,machine-learning-zoomcamp,4d98cd09
What are some starting points for learning about AWS Lambda runtimes?,machine-learning-zoomcamp,4d98cd09
How do you leverage the AWS Serverless Framework for AWS Lambda to create a REST API with API Gateway?,machine-learning-zoomcamp,59a81fd5
What is the process to turn a Docker image into a REST API via AWS Serverless?,machine-learning-zoomcamp,59a81fd5
How can AWS Serverless Framework facilitate deploying a Docker image to AWS Lambda and API Gateway?,machine-learning-zoomcamp,59a81fd5
Is there a guide available to deploy a serverless Flask application using AWS ECR and API Gateway?,machine-learning-zoomcamp,59a81fd5
Where can I find a detailed explanation of making a Docker image available as a REST API on AWS Lambda?,machine-learning-zoomcamp,59a81fd5
What can I do if I encounter a pip install error for the tflite runtime while building a docker image on an M1 Mac?,machine-learning-zoomcamp,35dbd6e2
How should I modify the docker build command for an M1 Mac to handle architecture issues?,machine-learning-zoomcamp,35dbd6e2
What is the recommended docker run command to use after building the image on an M1 Mac?,machine-learning-zoomcamp,35dbd6e2
Is there an alternative link for the tflite runtime whl if the original download fails on an M1 Mac?,machine-learning-zoomcamp,35dbd6e2
Why might the tflite runtime pip install error occur when building a docker image on an M1 Mac?,machine-learning-zoomcamp,35dbd6e2
What might cause an error when invoking the API Gateway deploy API locally in section 9?,machine-learning-zoomcamp,e5fe9efe
Which section describes the process of testing the API gateway?,machine-learning-zoomcamp,e5fe9efe
What solution is suggested for the 'Missing Authentication Token' error?,machine-learning-zoomcamp,e5fe9efe
Who added the solution for the API Gateway error in the record?,machine-learning-zoomcamp,e5fe9efe
What does the URL for a deployed API need to include for testing?,machine-learning-zoomcamp,e5fe9efe
What should I do if I encounter an error saying it cannot find a version for tflite_runtime?,machine-learning-zoomcamp,5c043c62
How can I resolve the issue with installing tflite_runtime using pip?,machine-learning-zoomcamp,5c043c62
What alternative options are available if tflite_runtime doesn't support my OS-Python version?,machine-learning-zoomcamp,5c043c62
Where can I find a version of tflite_runtime that works with AWS Lambda?,machine-learning-zoomcamp,5c043c62
What are some solutions for running code if tflite_runtime cannot be installed on my current system?,machine-learning-zoomcamp,5c043c62
What error might occur when running Docker for serverless deep learning?,machine-learning-zoomcamp,af0739da
How can I resolve the read-only file system error in Docker?,machine-learning-zoomcamp,af0739da
What should I do if I encounter the 'mkdir' error using Docker?,machine-learning-zoomcamp,af0739da
Who suggests restarting the Docker services to fix an error?,machine-learning-zoomcamp,af0739da
What is the solution provided by Krishna Anand for a Docker error?,machine-learning-zoomcamp,af0739da
How can a Docker image be saved and exported to a local machine?,machine-learning-zoomcamp,451bc25d
What command is used to export a Docker image to tar format?,machine-learning-zoomcamp,451bc25d
How can individual layers of a saved Docker image be accessed?,machine-learning-zoomcamp,451bc25d
What file needs to be extracted to view filesystem content of a Docker image?,machine-learning-zoomcamp,451bc25d
Who is associated with the explanation about saving Docker images?,machine-learning-zoomcamp,451bc25d
What should I do if my Jupyter notebook in VSCode does not recognize a package after installation?,machine-learning-zoomcamp,ea2e7458
Why might my Jupyter notebook not detect a package installed with pip on VSCode?,machine-learning-zoomcamp,ea2e7458
How can I resolve import errors in Jupyter notebooks after installing a package with pip?,machine-learning-zoomcamp,ea2e7458
What is a necessary step to take if import errors occur in Jupyter notebooks on VSCode after installing a package?,machine-learning-zoomcamp,ea2e7458
What should I do if I face import issues in Jupyter notebooks after using pip to install a package like pillow?,machine-learning-zoomcamp,ea2e7458
What should I do if I run out of space on my AWS instance?,machine-learning-zoomcamp,6ce8e875
Why does deleting docker images not free up space on my AWS instance?,machine-learning-zoomcamp,6ce8e875
How can I free up space on my 30-GB AWS instance after deleting images?,machine-learning-zoomcamp,6ce8e875
